question,answer
What do customers love most about the products?,"1. Direct answer to the question:
Customers love the unique flavors, quality, and taste of the products. Specifically, they enjoy the perfect blend of flavors in Gloria Jean's Mudslide, the salty and sweet taste of the Mars candy product, and the overall flavor profile of the k-cups and other food items. They also appreciate the convenience and affordability of purchasing these products through online platforms like Amazon.

2. Key sentiment findings:
The sentiment trends in these customer reviews are overwhelmingly positive, with customers expressing love, addiction, and enthusiasm for the products. The use of superlatives such as ""absolutely one of my new favorite flavors,"" ""perfect blend of flavors,"" and ""insanely good"" emphasizes the strong positive emotions associated with these products. However, one customer mentions that the price is a deterrent, which is a notable negative sentiment trend. Additionally, customers appreciate the quality of the products, the convenience of online shopping, and the decent shipping times.

3. Actionable recommendation for marketing teams:
Based on these customer reviews, marketing teams can take the following actions:
* Emphasize the unique and high-quality flavor profiles of the products in advertising and promotional materials.
* Highlight the convenience and affordability of purchasing these products through online platforms like Amazon.
* Consider offering discounts or promotions to address the price concerns mentioned by one customer.
* Use customer testimonials and reviews in marketing campaigns to showcase the positive emotions and enthusiasm associated with the products.
* Develop targeted marketing campaigns to reach customers who are looking for new and exciting flavors, as well as those who value convenience and quality.
* Monitor customer feedback and sentiment trends to identify areas for improvement and optimize marketing strategies accordingly."
What are the main complaints from negative reviews?,"1. **Direct answer to the question**: The main complaints from negative reviews are related to packaging issues, product quality, and the inability to return perishable items. Specifically, customers have mentioned that the packaging is prone to breaking, the product can arrive rotten or smelling, and there is no return policy for food items on Amazon.

2. **Key sentiment findings**: The sentiment trends in the negative reviews are overwhelmingly negative, with customers expressing frustration and disappointment with their experiences. The use of strong language, such as ""sucks"" and ""had to spit it out"", emphasizes the strength of these negative emotions. In contrast, positive reviews are enthusiastic and appreciative, with customers using phrases like ""LOVED it"" and ""will def. do business again"". The sentiment analysis also reveals that customers value the quality and taste of the products, but are let down by logistical and customer service issues.

3. **Actionable recommendation for marketing teams**: Based on these findings, marketing teams should prioritize addressing the packaging and quality control issues, as well as improving customer service and return policies for perishable items. Specifically, they could:
* Redesign packaging to be more durable and secure for shipping
* Implement stricter quality control measures to prevent rotten or smelling products from being shipped
* Develop a clear and customer-friendly return policy for food items, even if it's not through Amazon's standard return process
* Emphasize the quality and taste of the products in marketing materials, while also highlighting any improvements made to packaging and customer service
* Encourage customers to provide feedback and reviews, and respond promptly to negative reviews to show that their concerns are being heard and addressed."
What trends can you identify in consumer sentiment?,"**1. Direct answer to the question:** 
The trends in consumer sentiment identified from the customer reviews include a strong appreciation for products that meet specific needs, such as a strong coffee brew, healthy pet food, unique flavor enhancers, and nutritious instant meals. Consumers also value the quality of packaging and delivery, as well as the versatility of products that can be used in various ways.

**2. Key sentiment findings:** 
- **Positive sentiment towards products that meet specific needs:** Consumers express satisfaction with products that cater to their specific preferences, such as strong coffee, less smelly pet food, and healthy instant pasta.
- **Appreciation for quality packaging and delivery:** Reviewers mention the importance of receiving products in good condition, highlighting the reliability of certain brands or sellers.
- **Versatility and multiple uses:** Consumers appreciate products that can be used in different ways or combined with other ingredients to enhance flavor or nutritional value.
- **Emotional connections:** Some reviews indicate an emotional connection to the product, such as a cat's apparent preference for a particular brand of food or a child's enjoyment of a specific instant meal.

**3. Actionable recommendation for marketing teams:** 
Based on these trends, marketing teams can focus on the following strategies:
- **Highlight product uniqueness and benefits:** Emphasize how products meet specific consumer needs or preferences, such as strength, health benefits, or versatility.
- **Ensure reliable packaging and delivery:** Invest in secure packaging and partner with reliable shipping services to ensure products arrive in good condition, enhancing customer trust and satisfaction.
- **Leverage emotional connections:** Use storytelling and user-generated content in marketing campaigns to showcase the emotional bonds between consumers and products, such as pets enjoying their food or children delighting in a favorite meal.
- **Promote product versatility:** Provide recipes, tips, or suggestions on how products can be used in different ways, encouraging customers to explore new uses and enhancing the product's value proposition."
